### ISSUE TITLE
who is ks.ral.me????

### ISSUE THREAD

**Issue by funwun** [erlio/vernemq#508]
who is ks.ral.me????

```
ks.ral.me.1883 > 192.168.x.x.32697: Flags [R.], cksum 0x1474 (correct), seq 1, ack 7, win 64240, length 0
	0x0000:  4500 0028 2de2 0000 8006 3ef9 25bb 6a10  E..(-.....>.%.j.
	0x0010:  c0a8 7d81 075b 7fb9 1b8d 0d66 2ca9 f5c5  ..}..[.....f,...
	0x0020:  5014 faf0 1474 0000 0000 0000 0000       P....t........
12:32:28.990598 IP (tos 0x0, ttl 128, id 11852, offset 0, flags [none], proto TCP (6), length 42)
```

**Comment by larshesel** [comment]
Could you explain what we're looking at?

**Comment by funwun** [comment]
I never know this domain, and tcpdump the 1883 port, I get this, I guess vernemq send message to this server............

the domain IP info: http://www.ipgeeks.org/37.187.106.16

**Comment by larshesel** [comment]
The above means that ks.ral.me is sending something to you on whatever you have running on port 32697. Not that VerneMQ is sending something out.

**Comment by funwun** [comment]
12:32:12.092469 IP (tos 0x10, ttl 64, id 40935, offset 0, flags [DF], proto TCP (6), length 50)
    192.168.125.129.32693 > ks.ral.me.1883: Flags [P.], cksum 0xce19 (incorrect -> 0x1932), seq 1:11, ack 1, win 29200, length 10
	0x0000:  4510 0032 9fe7 4000 4006 ccd9 c0a8 7d81  E..2..@.@.....}.
	0x0010:  25bb 6a10 7fb5 075b 7e33 7f66 22cc 1657  %.j....[~3.f"..W
	0x0020:  5018 7210 ce19 0000 6173 6466 6173 6466  P.r.....asdfasdf
	0x0030:  0d0a                                     ..
12:32:12.092662 IP (tos 0x0, ttl 128, id 11735, offset 0, flags [none], proto TCP (6), length 40)
    ks.ral.me.1883 > 192.168.125.129.32693: Flags [.], cksum 0x2917 (correct), seq 1, ack 11, win 64240, length 0
	0x0000:  4500 0028 2dd7 0000 8006 3f04 25bb 6a10  E..(-.....?.%.j.
	0x0010:  c0a8 7d81 075b 7fb5 22cc 1657 7e33 7f70  ..}..[.."..W~3.p
	0x0020:  5010 faf0 2917 0000 0000 0000 0000       P...).........
12:32:12.356105 IP (tos 0x0, ttl 128, id 11736, offset 0, flags [none], proto TCP (6), length 40)
    ks.ral.me.1883 > 192.168.125.129.32693: Flags [R.], cksum 0x2913 (correct), seq 1, ack 11, win 64240, length 0
	0x0000:  4500 0028 2dd8 0000 8006 3f03 25bb 6a10  E..(-.....?.%.j.
	0x0010:  c0a8 7d81 075b 7fb5 22cc 1657 7e33 7f70  ..}..[.."..W~3.p
	0x0020:  5014 faf0 2913 0000 0000 0000 0000       P...).........
12:32:19.275786 IP (tos 0x10, ttl 64, id 7316, offset 0, flags [DF], proto TCP (6), length 60)
    192.168.125.129.32697 > ks.ral.me.1883: Flags [S], cksum 0xce23 (incorrect -> 0x7110), seq 749335998, win 29200, options [mss 1460,sackOK,TS val 71428394 ecr 0,nop,wscale 9], length 0
	0x0000:  4510 003c 1c94 4000 4006 5023 c0a8 7d81  E..<..@.@.P#..}.
	0x0010:  25bb 6a10 7fb9 075b 2ca9 f5be 0000 0000  %.j....[,.......
	0x0020:  a002 7210 ce23 0000 0204 05b4 0402 080a  ..r..#..........
	0x0030:  0441 e92a 0000 0000 0103 0309            .A.*........
12:32:19.528974 IP (tos 0x0, ttl 128, id 11744, offset 0, flags [none], proto TCP (6), length 44)
    ks.ral.me.1883 > 192.168.125.129.32697: Flags [S.], cksum 0xfcc0 (correct), seq 462228837, ack 749335999, win 64240, options [mss 1460], length 0
	0x0000:  4500 002c 2de0 0000 8006 3ef7 25bb 6a10  E..,-.....>.%.j.
	0x0010:  c0a8 7d81 075b 7fb9 1b8d 0d65 2ca9 f5bf  ..}..[.....e,...
	0x0020:  6012 faf0 fcc0 0000 0204 05b4 0000       `.............
12:32:19.529038 IP (tos 0x10, ttl 64, id 7317, offset 0, flags [DF], proto TCP (6), length 40)
    192.168.125.129.32697 > ks.ral.me.1883: Flags [.], cksum 0xce0f (incorrect -> 0x9d5e), seq 1, ack 1, win 29200, length 0
	0x0000:  4510 0028 1c95 4000 4006 5036 c0a8 7d81  E..(..@.@.P6..}.
	0x0010:  25bb 6a10 7fb9 075b 2ca9 f5bf 1b8d 0d66  %.j....[,......f
	0x0020:  5010 7210 ce0f 0000                      P.r.....
12:32:21.173841 IP (tos 0x10, ttl 64, id 7318, offset 0, flags [DF], proto TCP (6), length 46)
    192.168.125.129.32697 > ks.ral.me.1883: Flags [P.], cksum 0xce15 (incorrect -> 0xca6c), seq 1:7, ack 1, win 29200, length 6
	0x0000:  4510 002e 1c96 4000 4006 502f c0a8 7d81  E.....@.@.P/..}.
	0x0010:  25bb 6a10 7fb9 075b 2ca9 f5bf 1b8d 0d66  %.j....[,......f
	0x0020:  5018 7210 ce15 0000 6173 6466 0d0a       P.r.....asdf..
12:32:21.174313 IP (tos 0x0, ttl 128, id 11745, offset 0, flags [none], proto TCP (6), length 40)
    ks.ral.me.1883 > 192.168.125.129.32697: Flags [.], cksum 0x1478 (correct), seq 1, ack 7, win 64240, length 0
	0x0000:  4500 0028 2de1 0000 8006 3efa 25bb 6a10  E..(-.....>.%.j.
	0x0010:  c0a8 7d81 075b 7fb9 1b8d 0d66 2ca9 f5c5  ..}..[.....f,...
	0x0020:  5010 faf0 1478 0000 0000 0000 0000       P....x........
12:32:21.458470 IP (tos 0x0, ttl 128, id 11746, offset 0, flags [none], proto TCP (6), length 40)
    ks.ral.me.1883 > 192.168.125.129.32697: Flags [R.], cksum 0x1474 (correct), seq 1, ack 7, win 64240, length 0
	0x0000:  4500 0028 2de2 0000 8006 3ef9 25bb 6a10  E..(-.....>.%.j.
	0x0010:  c0a8 7d81 075b 7fb9 1b8d 0d66 2ca9 f5c5  ..}..[.....f,...
	0x0020:  5014 faf0 1474 0000 0000 0000 0000       P....t........

**Comment by larshesel** [comment]
Why do you think this has anything to do with VerneMQ?

**Comment by funwun** [comment]
When I connect to vernemq broker, I get this tcp dump message

**Comment by larshesel** [comment]
On which port is VerneMQ running? 

The above traces show:

1. data coming from ks.ral.me port 1883 **to** 192.168.125.129 port 32697
2. data being sent from 192.168.125.129 port 32697 to ks.ral.me port 1883

So what is running on your machine on port 32697?

**Comment by funwun** [comment]
OK, maybe my mistake.
