### ISSUE TITLE
Connection reset when using websocket with proxy_protocol

### ISSUE THREAD

**Issue by cbenhagen** [erlio/vernemq#896]
### Environment
Docker image erlio/docker-vernemq:1.5.0

- VerneMQ Version: 1.5.0
- OS: Debian Jessie
- Erlang/OTP version (if building from source):

vernemq.conf.local:
```
log.console=console
log.console.level=debug
allow_anonymous=on
listener.ws.proxy_protocol = on
listener.ws.default = 0.0.0.0:8080
```
### Expected behavior

- Established connection

### Actual behaviour
Using python paho-mqtt:
`ConnectionResetError: [Errno 104] Connection reset by peer`

When removing `listener.ws.proxy_protocol = on` everything works as expected.
This might be related to https://github.com/erlio/vernemq/issues/524
```
config is OK
-config /var/lib/vernemq/generated.configs/app.2018.10.15.07.07.56.config -args_file /etc/vernemq/vm.args -vm_args /etc/vernemq/vm.args
Exec:  /usr/lib/vernemq/erts-8.3.5.3/bin/erlexec -boot /usr/lib/vernemq/releases/1.5.0/vernemq               -config /var/lib/vernemq/generated.configs/app.2018.10.15.07.07.56.config -args_file /etc/vernemq/vm.args -vm_args /etc/vernemq/vm.args              -pa /usr/lib/vernemq/lib/erlio-patches -- console -noshell -noinput
Root: /usr/lib/vernemq

=INFO REPORT==== 15-Oct-2018::07:07:58 ===
    alarm_handler: {set,{system_memory_high_watermark,[]}}
07:07:58.471 [debug] Lager installed handler {lager_file_backend,"/var/log/vernemq/error.log"} into lager_event
07:07:58.482 [debug] Lager installed handler error_logger_lager_h into error_logger
07:07:58.514 [debug] Supervisor gr_param_sup started gr_param:start_link(gr_lager_default_tracer_params) at pid <0.187.0>
07:07:58.514 [debug] Supervisor gr_counter_sup started gr_counter:start_link(gr_lager_default_tracer_counters) at pid <0.188.0>
07:07:58.514 [debug] Supervisor gr_manager_sup started gr_manager:start_link(gr_lager_default_tracer_params_mgr, gr_lager_default_tracer_params, []) at pid <0.189.0>
07:07:58.515 [debug] Supervisor gr_manager_sup started gr_manager:start_link(gr_lager_default_tracer_counters_mgr, gr_lager_default_tracer_counters, [{input,0},{filter,0},{output,0}]) at pid <0.190.0>
07:07:58.731 [info] Application lager started on node 'VerneMQ@172.17.0.3'
07:07:58.750 [debug] Supervisor vmq_plugin_sup started vmq_plugin_mgr:start_link() at pid <0.196.0>
07:07:58.750 [info] Application vmq_plugin started on node 'VerneMQ@172.17.0.3'
07:07:58.750 [info] Application ssl_verify_fun started on node 'VerneMQ@172.17.0.3'
07:07:58.751 [info] Application epgsql started on node 'VerneMQ@172.17.0.3'
07:07:58.770 [info] read state from file {[{[{actor,<<66,228,220,62,84,115,95,14,148,86,207,149,172,39,52,70,212,51,1,160>>}],1}],{dict,1,16,16,8,80,48,{[],[],[],[],[],[],[],[],[],[],[],[],[],[],[],[]},{{[],[],[],[['VerneMQ@172.17.0.3',{[{actor,<<66,228,220,62,84,115,95,14,148,86,207,149,172,39,52,70,212,51,1,160>>}],1}]],[],[],[],[],[],[],[],[],[],[],[],[]}}},{dict,0,16,16,8,80,48,{[],[],[],[],[],[],[],[],[],[],[],[],[],[],[],[]},{{[],[],[],[],[],[],[],[],[],[],[],[],[],[],[],[]}}}}
07:07:58.770 [info] writing state {[{[{actor,<<66,228,220,62,84,115,95,14,148,86,207,149,172,39,52,70,212,51,1,160>>}],1}],{dict,1,16,16,8,80,48,{[],[],[],[],[],[],[],[],[],[],[],[],[],[],[],[]},{{[],[],[],[['VerneMQ@172.17.0.3',{[{actor,<<66,228,220,62,84,115,95,14,148,86,207,149,172,39,52,70,212,51,1,160>>}],1}]],[],[],[],[],[],[],[],[],[],[],[],[]}}},{dict,0,16,16,8,80,48,{[],[],[],[],[],[],[],[],[],[],[],[],[],[],[],[]},{{[],[],[],[],[],[],[],[],[],[],[],[],[],[],[],[]}}}} to disk <<75,2,131,80,0,0,0,248,120,1,203,96,206,97,96,96,96,204,96,130,82,41,12,172,137,201,37,249,69,185,64,81,17,167,39,119,236,66,138,227,249,166,132,157,159,186,70,221,196,237,138,49,227,130,172,68,198,172,12,206,20,6,150,148,204,228,146,68,198,68,1,32,228,72,12,72,52,200,16,200,66,3,25,140,96,49,176,201,32,130,41,133,65,40,44,181,40,47,213,55,208,193,208,220,72,207,208,92,207,64,207,152,52,171,81,172,64,184,131,129,8,119,160,104,5,0,72,187,75,98>>
07:07:58.778 [debug] Supervisor plumtree_sup started plumtree_metadata_leveldb_iterator_sup:start_link() at pid <0.205.0>
07:07:58.807 [info] Datadir /var/lib/vernemq/meta/meta/0 options for LevelDB: [{open,[{block_cache_threshold,33554432},{block_restart_interval,16},{block_size_steps,16},{compression,true},{create_if_missing,true},{delete_threshold,1000},{eleveldb_threads,71},{fadvise_willneed,false},{limited_developer_mem,false},{sst_block_size,4096},{tiered_slow_level,0},{total_leveldb_mem_percent,6},{use_bloomfilter,true},{write_buffer_size,60283058}]},{read,[{verify_checksums,true}]},{write,[{sync,false}]},{fold,[{verify_checksums,true},{fill_cache,false}]}]
07:07:58.813 [debug] Supervisor plumtree_metadata_leveldb_instance_sup started plumtree_metadata_leveldb_instance:start_link(0, [{sync,false},{total_leveldb_mem_percent,6},{use_bloomfilter,true}]) at pid <0.207.0>
07:07:58.813 [info] Datadir /var/lib/vernemq/meta/meta/1 options for LevelDB: [{open,[{block_cache_threshold,33554432},{block_restart_interval,16},{block_size_steps,16},{compression,true},{create_if_missing,true},{delete_threshold,1000},{eleveldb_threads,71},{fadvise_willneed,false},{limited_developer_mem,false},{sst_block_size,4096},{tiered_slow_level,0},{total_leveldb_mem_percent,6},{use_bloomfilter,true},{write_buffer_size,42120244}]},{read,[{verify_checksums,true}]},{write,[{sync,false}]},{fold,[{verify_checksums,true},{fill_cache,false}]}]
07:07:58.824 [debug] Supervisor plumtree_metadata_leveldb_instance_sup started plumtree_metadata_leveldb_instance:start_link(1, [{sync,false},{total_leveldb_mem_percent,6},{use_bloomfilter,true}]) at pid <0.209.0>
07:07:58.824 [info] Datadir /var/lib/vernemq/meta/meta/2 options for LevelDB: [{open,[{block_cache_threshold,33554432},{block_restart_interval,16},{block_size_steps,16},{compression,true},{create_if_missing,true},{delete_threshold,1000},{eleveldb_threads,71},{fadvise_willneed,false},{limited_developer_mem,false},{sst_block_size,4096},{tiered_slow_level,0},{total_leveldb_mem_percent,6},{use_bloomfilter,true},{write_buffer_size,42990778}]},{read,[{verify_checksums,true}]},{write,[{sync,false}]},{fold,[{verify_checksums,true},{fill_cache,false}]}]
07:07:58.832 [debug] Supervisor plumtree_metadata_leveldb_instance_sup started plumtree_metadata_leveldb_instance:start_link(2, [{sync,false},{total_leveldb_mem_percent,6},{use_bloomfilter,true}]) at pid <0.210.0>
07:07:58.832 [info] Datadir /var/lib/vernemq/meta/meta/3 options for LevelDB: [{open,[{block_cache_threshold,33554432},{block_restart_interval,16},{block_size_steps,16},{compression,true},{create_if_missing,true},{delete_threshold,1000},{eleveldb_threads,71},{fadvise_willneed,false},{limited_developer_mem,false},{sst_block_size,4096},{tiered_slow_level,0},{total_leveldb_mem_percent,6},{use_bloomfilter,true},{write_buffer_size,32818057}]},{read,[{verify_checksums,true}]},{write,[{sync,false}]},{fold,[{verify_checksums,true},{fill_cache,false}]}]
07:07:58.838 [debug] Supervisor plumtree_metadata_leveldb_instance_sup started plumtree_metadata_leveldb_instance:start_link(3, [{sync,false},{total_leveldb_mem_percent,6},{use_bloomfilter,true}]) at pid <0.211.0>
07:07:58.839 [info] Datadir /var/lib/vernemq/meta/meta/4 options for LevelDB: [{open,[{block_cache_threshold,33554432},{block_restart_interval,16},{block_size_steps,16},{compression,true},{create_if_missing,true},{delete_threshold,1000},{eleveldb_threads,71},{fadvise_willneed,false},{limited_developer_mem,false},{sst_block_size,4096},{tiered_slow_level,0},{total_leveldb_mem_percent,6},{use_bloomfilter,true},{write_buffer_size,43267449}]},{read,[{verify_checksums,true}]},{write,[{sync,false}]},{fold,[{verify_checksums,true},{fill_cache,false}]}]
07:07:58.846 [debug] Supervisor plumtree_metadata_leveldb_instance_sup started plumtree_metadata_leveldb_instance:start_link(4, [{sync,false},{total_leveldb_mem_percent,6},{use_bloomfilter,true}]) at pid <0.212.0>
07:07:58.846 [info] Datadir /var/lib/vernemq/meta/meta/5 options for LevelDB: [{open,[{block_cache_threshold,33554432},{block_restart_interval,16},{block_size_steps,16},{compression,true},{create_if_missing,true},{delete_threshold,1000},{eleveldb_threads,71},{fadvise_willneed,false},{limited_developer_mem,false},{sst_block_size,4096},{tiered_slow_level,0},{total_leveldb_mem_percent,6},{use_bloomfilter,true},{write_buffer_size,56241811}]},{read,[{verify_checksums,true}]},{write,[{sync,false}]},{fold,[{verify_checksums,true},{fill_cache,false}]}]
07:07:58.852 [debug] Supervisor plumtree_metadata_leveldb_instance_sup started plumtree_metadata_leveldb_instance:start_link(5, [{sync,false},{total_leveldb_mem_percent,6},{use_bloomfilter,true}]) at pid <0.213.0>
07:07:58.853 [info] Datadir /var/lib/vernemq/meta/meta/6 options for LevelDB: [{open,[{block_cache_threshold,33554432},{block_restart_interval,16},{block_size_steps,16},{compression,true},{create_if_missing,true},{delete_threshold,1000},{eleveldb_threads,71},{fadvise_willneed,false},{limited_developer_mem,false},{sst_block_size,4096},{tiered_slow_level,0},{total_leveldb_mem_percent,6},{use_bloomfilter,true},{write_buffer_size,34902334}]},{read,[{verify_checksums,true}]},{write,[{sync,false}]},{fold,[{verify_checksums,true},{fill_cache,false}]}]
07:07:58.859 [debug] Supervisor plumtree_metadata_leveldb_instance_sup started plumtree_metadata_leveldb_instance:start_link(6, [{sync,false},{total_leveldb_mem_percent,6},{use_bloomfilter,true}]) at pid <0.214.0>
07:07:58.860 [info] Datadir /var/lib/vernemq/meta/meta/7 options for LevelDB: [{open,[{block_cache_threshold,33554432},{block_restart_interval,16},{block_size_steps,16},{compression,true},{create_if_missing,true},{delete_threshold,1000},{eleveldb_threads,71},{fadvise_willneed,false},{limited_developer_mem,false},{sst_block_size,4096},{tiered_slow_level,0},{total_leveldb_mem_percent,6},{use_bloomfilter,true},{write_buffer_size,55610643}]},{read,[{verify_checksums,true}]},{write,[{sync,false}]},{fold,[{verify_checksums,true},{fill_cache,false}]}]
07:07:58.867 [debug] Supervisor plumtree_metadata_leveldb_instance_sup started plumtree_metadata_leveldb_instance:start_link(7, [{sync,false},{total_leveldb_mem_percent,6},{use_bloomfilter,true}]) at pid <0.215.0>
07:07:58.867 [info] Datadir /var/lib/vernemq/meta/meta/8 options for LevelDB: [{open,[{block_cache_threshold,33554432},{block_restart_interval,16},{block_size_steps,16},{compression,true},{create_if_missing,true},{delete_threshold,1000},{eleveldb_threads,71},{fadvise_willneed,false},{limited_developer_mem,false},{sst_block_size,4096},{tiered_slow_level,0},{total_leveldb_mem_percent,6},{use_bloomfilter,true},{write_buffer_size,51852124}]},{read,[{verify_checksums,true}]},{write,[{sync,false}]},{fold,[{verify_checksums,true},{fill_cache,false}]}]
07:07:58.875 [debug] Supervisor plumtree_metadata_leveldb_instance_sup started plumtree_metadata_leveldb_instance:start_link(8, [{sync,false},{total_leveldb_mem_percent,6},{use_bloomfilter,true}]) at pid <0.216.0>
07:07:58.875 [info] Datadir /var/lib/vernemq/meta/meta/9 options for LevelDB: [{open,[{block_cache_threshold,33554432},{block_restart_interval,16},{block_size_steps,16},{compression,true},{create_if_missing,true},{delete_threshold,1000},{eleveldb_threads,71},{fadvise_willneed,false},{limited_developer_mem,false},{sst_block_size,4096},{tiered_slow_level,0},{total_leveldb_mem_percent,6},{use_bloomfilter,true},{write_buffer_size,59797396}]},{read,[{verify_checksums,true}]},{write,[{sync,false}]},{fold,[{verify_checksums,true},{fill_cache,false}]}]
07:07:58.881 [debug] Supervisor plumtree_metadata_leveldb_instance_sup started plumtree_metadata_leveldb_instance:start_link(9, [{sync,false},{total_leveldb_mem_percent,6},{use_bloomfilter,true}]) at pid <0.217.0>
07:07:58.881 [info] Datadir /var/lib/vernemq/meta/meta/10 options for LevelDB: [{open,[{block_cache_threshold,33554432},{block_restart_interval,16},{block_size_steps,16},{compression,true},{create_if_missing,true},{delete_threshold,1000},{eleveldb_threads,71},{fadvise_willneed,false},{limited_developer_mem,false},{sst_block_size,4096},{tiered_slow_level,0},{total_leveldb_mem_percent,6},{use_bloomfilter,true},{write_buffer_size,38722050}]},{read,[{verify_checksums,true}]},{write,[{sync,false}]},{fold,[{verify_checksums,true},{fill_cache,false}]}]
07:07:58.890 [debug] Supervisor plumtree_metadata_leveldb_instance_sup started plumtree_metadata_leveldb_instance:start_link(10, [{sync,false},{total_leveldb_mem_percent,6},{use_bloomfilter,true}]) at pid <0.218.0>
07:07:58.891 [info] Datadir /var/lib/vernemq/meta/meta/11 options for LevelDB: [{open,[{block_cache_threshold,33554432},{block_restart_interval,16},{block_size_steps,16},{compression,true},{create_if_missing,true},{delete_threshold,1000},{eleveldb_threads,71},{fadvise_willneed,false},{limited_developer_mem,false},{sst_block_size,4096},{tiered_slow_level,0},{total_leveldb_mem_percent,6},{use_bloomfilter,true},{write_buffer_size,62039370}]},{read,[{verify_checksums,true}]},{write,[{sync,false}]},{fold,[{verify_checksums,true},{fill_cache,false}]}]
07:07:58.897 [debug] Supervisor plumtree_metadata_leveldb_instance_sup started plumtree_metadata_leveldb_instance:start_link(11, [{sync,false},{total_leveldb_mem_percent,6},{use_bloomfilter,true}]) at pid <0.219.0>
07:07:58.897 [debug] Supervisor plumtree_sup started plumtree_metadata_leveldb_instance_sup:start_link() at pid <0.206.0>
07:07:58.906 [debug] Supervisor plumtree_sup started plumtree_peer_service_gossip:start_link() at pid <0.220.0>
07:07:58.914 [debug] Supervisor plumtree_sup started plumtree_peer_service_events:start_link() at pid <0.221.0>
07:07:58.928 [debug] 0ms mailbox traversal, schedule next lazy broadcast in 10000ms, the min interval is 10000ms
07:07:58.928 [debug] Supervisor plumtree_sup started plumtree_broadcast:start_link() at pid <0.222.0>
07:07:58.932 [debug] Supervisor plumtree_sup started plumtree_metadata_manager:start_link() at pid <0.223.0>
07:07:58.958 [debug] Lager installed handler lager_backend_throttle into lager_event
07:07:58.976 [debug] Supervisor plumtree_sup started plumtree_metadata_hashtree:start_link() at pid <0.224.0>
07:07:58.977 [info] Application plumtree started on node 'VerneMQ@172.17.0.3'
07:07:59.030 [debug] Supervisor hackney_sup started hackney_manager:start_link() at pid <0.231.0>
07:07:59.035 [info] Application hackney started on node 'VerneMQ@172.17.0.3'
07:07:59.050 [debug] Supervisor inets_sup started ftp_sup:start_link() at pid <0.236.0>
07:07:59.108 [debug] Supervisor httpc_profile_sup started httpc_manager:start_link(default, only_session_cookies, inets) at pid <0.239.0>
07:07:59.108 [debug] Supervisor httpc_sup started httpc_profile_sup:start_link([{httpc,{default,only_session_cookies}}]) at pid <0.238.0>
07:07:59.120 [debug] Supervisor httpc_sup started httpc_handler_sup:start_link() at pid <0.240.0>
07:07:59.120 [debug] Supervisor inets_sup started httpc_sup:start_link([{httpc,{default,only_session_cookies}}]) at pid <0.237.0>
07:07:59.133 [debug] Supervisor inets_sup started httpd_sup:start_link([]) at pid <0.241.0>
07:07:59.136 [debug] Supervisor inets_sup started tftp_sup:start_link([]) at pid <0.242.0>
07:07:59.137 [info] Application inets started on node 'VerneMQ@172.17.0.3'
07:07:59.137 [info] Application xmerl started on node 'VerneMQ@172.17.0.3'
07:07:59.221 [debug] loading modules: [vmq_plumtree,vmq_plumtree_app,vmq_plumtree_sup]
07:07:59.221 [info] Application vmq_plumtree started on node 'VerneMQ@172.17.0.3'
07:07:59.249 [info] Try to start vmq_plumtree: ok
07:07:59.312 [debug] Supervisor vmq_server_sup started vmq_config:start_link() at pid <0.253.0>
07:07:59.323 [debug] datadir /var/lib/vernemq/msgstore/1 options for LevelDB: [{open,[{block_cache_threshold,33554432},{block_restart_interval,16},{block_size_steps,16},{compression,true},{create_if_missing,true},{delete_threshold,1000},{eleveldb_threads,71},{fadvise_willneed,false},{limited_developer_mem,false},{sst_block_size,4096},{tiered_slow_level,0},{total_leveldb_mem_percent,70},{use_bloomfilter,true},{write_buffer_size,56690880}]},{read,[{verify_checksums,true}]},{write,[{sync,false}]},{fold,[{verify_checksums,true},{fill_cache,false}]}]
07:07:59.329 [debug] Supervisor vmq_lvldb_store_sup started vmq_lvldb_store:start_link(1) at pid <0.256.0>
07:07:59.330 [debug] datadir /var/lib/vernemq/msgstore/2 options for LevelDB: [{open,[{block_cache_threshold,33554432},{block_restart_interval,16},{block_size_steps,16},{compression,true},{create_if_missing,true},{delete_threshold,1000},{eleveldb_threads,71},{fadvise_willneed,false},{limited_developer_mem,false},{sst_block_size,4096},{tiered_slow_level,0},{total_leveldb_mem_percent,70},{use_bloomfilter,true},{write_buffer_size,50002691}]},{read,[{verify_checksums,true}]},{write,[{sync,false}]},{fold,[{verify_checksums,true},{fill_cache,false}]}]
07:07:59.335 [debug] Supervisor vmq_lvldb_store_sup started vmq_lvldb_store:start_link(2) at pid <0.257.0>
07:07:59.336 [debug] datadir /var/lib/vernemq/msgstore/3 options for LevelDB: [{open,[{block_cache_threshold,33554432},{block_restart_interval,16},{block_size_steps,16},{compression,true},{create_if_missing,true},{delete_threshold,1000},{eleveldb_threads,71},{fadvise_willneed,false},{limited_developer_mem,false},{sst_block_size,4096},{tiered_slow_level,0},{total_leveldb_mem_percent,70},{use_bloomfilter,true},{write_buffer_size,55594612}]},{read,[{verify_checksums,true}]},{write,[{sync,false}]},{fold,[{verify_checksums,true},{fill_cache,false}]}]
07:07:59.345 [debug] Supervisor vmq_lvldb_store_sup started vmq_lvldb_store:start_link(3) at pid <0.258.0>
07:07:59.346 [debug] datadir /var/lib/vernemq/msgstore/4 options for LevelDB: [{open,[{block_cache_threshold,33554432},{block_restart_interval,16},{block_size_steps,16},{compression,true},{create_if_missing,true},{delete_threshold,1000},{eleveldb_threads,71},{fadvise_willneed,false},{limited_developer_mem,false},{sst_block_size,4096},{tiered_slow_level,0},{total_leveldb_mem_percent,70},{use_bloomfilter,true},{write_buffer_size,34461636}]},{read,[{verify_checksums,true}]},{write,[{sync,false}]},{fold,[{verify_checksums,true},{fill_cache,false}]}]
07:07:59.353 [debug] Supervisor vmq_lvldb_store_sup started vmq_lvldb_store:start_link(4) at pid <0.259.0>
07:07:59.354 [debug] datadir /var/lib/vernemq/msgstore/5 options for LevelDB: [{open,[{block_cache_threshold,33554432},{block_restart_interval,16},{block_size_steps,16},{compression,true},{create_if_missing,true},{delete_threshold,1000},{eleveldb_threads,71},{fadvise_willneed,false},{limited_developer_mem,false},{sst_block_size,4096},{tiered_slow_level,0},{total_leveldb_mem_percent,70},{use_bloomfilter,true},{write_buffer_size,35880821}]},{read,[{verify_checksums,true}]},{write,[{sync,false}]},{fold,[{verify_checksums,true},{fill_cache,false}]}]
07:07:59.358 [debug] Supervisor vmq_lvldb_store_sup started vmq_lvldb_store:start_link(5) at pid <0.260.0>
07:07:59.359 [debug] datadir /var/lib/vernemq/msgstore/6 options for LevelDB: [{open,[{block_cache_threshold,33554432},{block_restart_interval,16},{block_size_steps,16},{compression,true},{create_if_missing,true},{delete_threshold,1000},{eleveldb_threads,71},{fadvise_willneed,false},{limited_developer_mem,false},{sst_block_size,4096},{tiered_slow_level,0},{total_leveldb_mem_percent,70},{use_bloomfilter,true},{write_buffer_size,35424213}]},{read,[{verify_checksums,true}]},{write,[{sync,false}]},{fold,[{verify_checksums,true},{fill_cache,false}]}]
07:07:59.366 [debug] Supervisor vmq_lvldb_store_sup started vmq_lvldb_store:start_link(6) at pid <0.261.0>
07:07:59.367 [debug] datadir /var/lib/vernemq/msgstore/7 options for LevelDB: [{open,[{block_cache_threshold,33554432},{block_restart_interval,16},{block_size_steps,16},{compression,true},{create_if_missing,true},{delete_threshold,1000},{eleveldb_threads,71},{fadvise_willneed,false},{limited_developer_mem,false},{sst_block_size,4096},{tiered_slow_level,0},{total_leveldb_mem_percent,70},{use_bloomfilter,true},{write_buffer_size,50467760}]},{read,[{verify_checksums,true}]},{write,[{sync,false}]},{fold,[{verify_checksums,true},{fill_cache,false}]}]
07:07:59.372 [debug] Supervisor vmq_lvldb_store_sup started vmq_lvldb_store:start_link(7) at pid <0.262.0>
07:07:59.372 [debug] datadir /var/lib/vernemq/msgstore/8 options for LevelDB: [{open,[{block_cache_threshold,33554432},{block_restart_interval,16},{block_size_steps,16},{compression,true},{create_if_missing,true},{delete_threshold,1000},{eleveldb_threads,71},{fadvise_willneed,false},{limited_developer_mem,false},{sst_block_size,4096},{tiered_slow_level,0},{total_leveldb_mem_percent,70},{use_bloomfilter,true},{write_buffer_size,54928324}]},{read,[{verify_checksums,true}]},{write,[{sync,false}]},{fold,[{verify_checksums,true},{fill_cache,false}]}]
07:07:59.377 [debug] Supervisor vmq_lvldb_store_sup started vmq_lvldb_store:start_link(8) at pid <0.263.0>
07:07:59.378 [debug] datadir /var/lib/vernemq/msgstore/9 options for LevelDB: [{open,[{block_cache_threshold,33554432},{block_restart_interval,16},{block_size_steps,16},{compression,true},{create_if_missing,true},{delete_threshold,1000},{eleveldb_threads,71},{fadvise_willneed,false},{limited_developer_mem,false},{sst_block_size,4096},{tiered_slow_level,0},{total_leveldb_mem_percent,70},{use_bloomfilter,true},{write_buffer_size,48728551}]},{read,[{verify_checksums,true}]},{write,[{sync,false}]},{fold,[{verify_checksums,true},{fill_cache,false}]}]
07:07:59.383 [debug] Supervisor vmq_lvldb_store_sup started vmq_lvldb_store:start_link(9) at pid <0.264.0>
07:07:59.384 [debug] datadir /var/lib/vernemq/msgstore/10 options for LevelDB: [{open,[{block_cache_threshold,33554432},{block_restart_interval,16},{block_size_steps,16},{compression,true},{create_if_missing,true},{delete_threshold,1000},{eleveldb_threads,71},{fadvise_willneed,false},{limited_developer_mem,false},{sst_block_size,4096},{tiered_slow_level,0},{total_leveldb_mem_percent,70},{use_bloomfilter,true},{write_buffer_size,45138616}]},{read,[{verify_checksums,true}]},{write,[{sync,false}]},{fold,[{verify_checksums,true},{fill_cache,false}]}]
07:07:59.390 [debug] Supervisor vmq_lvldb_store_sup started vmq_lvldb_store:start_link(10) at pid <0.265.0>
07:07:59.391 [debug] datadir /var/lib/vernemq/msgstore/11 options for LevelDB: [{open,[{block_cache_threshold,33554432},{block_restart_interval,16},{block_size_steps,16},{compression,true},{create_if_missing,true},{delete_threshold,1000},{eleveldb_threads,71},{fadvise_willneed,false},{limited_developer_mem,false},{sst_block_size,4096},{tiered_slow_level,0},{total_leveldb_mem_percent,70},{use_bloomfilter,true},{write_buffer_size,31492447}]},{read,[{verify_checksums,true}]},{write,[{sync,false}]},{fold,[{verify_checksums,true},{fill_cache,false}]}]
07:07:59.402 [debug] Supervisor vmq_lvldb_store_sup started vmq_lvldb_store:start_link(11) at pid <0.266.0>
07:07:59.403 [debug] datadir /var/lib/vernemq/msgstore/12 options for LevelDB: [{open,[{block_cache_threshold,33554432},{block_restart_interval,16},{block_size_steps,16},{compression,true},{create_if_missing,true},{delete_threshold,1000},{eleveldb_threads,71},{fadvise_willneed,false},{limited_developer_mem,false},{sst_block_size,4096},{tiered_slow_level,0},{total_leveldb_mem_percent,70},{use_bloomfilter,true},{write_buffer_size,31614009}]},{read,[{verify_checksums,true}]},{write,[{sync,false}]},{fold,[{verify_checksums,true},{fill_cache,false}]}]
07:07:59.410 [debug] Supervisor vmq_lvldb_store_sup started vmq_lvldb_store:start_link(12) at pid <0.267.0>
07:07:59.642 [debug] Supervisor vmq_server_sup started vmq_lvldb_store_sup:start_link() at pid <0.255.0>
07:07:59.650 [debug] Supervisor vmq_server_sup started vmq_crl_srv:start_link() at pid <0.272.0>
07:07:59.657 [debug] Supervisor vmq_queue_sup_sup started vmq_queue_sup:start_link(infinity, vmq_queue_sup_1, vmq_queue_sup_1_tab, 5, 10) at pid <0.274.0>
07:07:59.657 [debug] Supervisor vmq_queue_sup_sup started vmq_queue_sup:start_link(infinity, vmq_queue_sup_2, vmq_queue_sup_2_tab, 5, 10) at pid <0.275.0>
07:07:59.658 [debug] Supervisor vmq_queue_sup_sup started vmq_queue_sup:start_link(infinity, vmq_queue_sup_3, vmq_queue_sup_3_tab, 5, 10) at pid <0.276.0>
07:07:59.658 [debug] Supervisor vmq_queue_sup_sup started vmq_queue_sup:start_link(infinity, vmq_queue_sup_4, vmq_queue_sup_4_tab, 5, 10) at pid <0.277.0>
07:07:59.658 [debug] Supervisor vmq_queue_sup_sup started vmq_queue_sup:start_link(infinity, vmq_queue_sup_5, vmq_queue_sup_5_tab, 5, 10) at pid <0.278.0>
07:07:59.659 [debug] Supervisor vmq_queue_sup_sup started vmq_queue_sup:start_link(infinity, vmq_queue_sup_6, vmq_queue_sup_6_tab, 5, 10) at pid <0.279.0>
07:07:59.659 [debug] Supervisor vmq_queue_sup_sup started vmq_queue_sup:start_link(infinity, vmq_queue_sup_7, vmq_queue_sup_7_tab, 5, 10) at pid <0.280.0>
07:07:59.659 [debug] Supervisor vmq_queue_sup_sup started vmq_queue_sup:start_link(infinity, vmq_queue_sup_8, vmq_queue_sup_8_tab, 5, 10) at pid <0.281.0>
07:07:59.660 [debug] Supervisor vmq_queue_sup_sup started vmq_queue_sup:start_link(infinity, vmq_queue_sup_9, vmq_queue_sup_9_tab, 5, 10) at pid <0.282.0>
07:07:59.660 [debug] Supervisor vmq_queue_sup_sup started vmq_queue_sup:start_link(infinity, vmq_queue_sup_10, vmq_queue_sup_10_tab, 5, 10) at pid <0.283.0>
07:07:59.660 [debug] Supervisor vmq_queue_sup_sup started vmq_queue_sup:start_link(infinity, vmq_queue_sup_11, vmq_queue_sup_11_tab, 5, 10) at pid <0.284.0>
07:07:59.661 [debug] Supervisor vmq_queue_sup_sup started vmq_queue_sup:start_link(infinity, vmq_queue_sup_12, vmq_queue_sup_12_tab, 5, 10) at pid <0.285.0>
07:07:59.661 [debug] Supervisor vmq_queue_sup_sup started vmq_queue_sup:start_link(infinity, vmq_queue_sup_13, vmq_queue_sup_13_tab, 5, 10) at pid <0.286.0>
07:07:59.661 [debug] Supervisor vmq_queue_sup_sup started vmq_queue_sup:start_link(infinity, vmq_queue_sup_14, vmq_queue_sup_14_tab, 5, 10) at pid <0.287.0>
07:07:59.662 [debug] Supervisor vmq_queue_sup_sup started vmq_queue_sup:start_link(infinity, vmq_queue_sup_15, vmq_queue_sup_15_tab, 5, 10) at pid <0.288.0>
07:07:59.662 [debug] Supervisor vmq_queue_sup_sup started vmq_queue_sup:start_link(infinity, vmq_queue_sup_16, vmq_queue_sup_16_tab, 5, 10) at pid <0.289.0>
07:07:59.662 [debug] Supervisor vmq_queue_sup_sup started vmq_queue_sup:start_link(infinity, vmq_queue_sup_17, vmq_queue_sup_17_tab, 5, 10) at pid <0.290.0>
07:07:59.663 [debug] Supervisor vmq_queue_sup_sup started vmq_queue_sup:start_link(infinity, vmq_queue_sup_18, vmq_queue_sup_18_tab, 5, 10) at pid <0.291.0>
07:07:59.663 [debug] Supervisor vmq_queue_sup_sup started vmq_queue_sup:start_link(infinity, vmq_queue_sup_19, vmq_queue_sup_19_tab, 5, 10) at pid <0.292.0>
07:07:59.663 [debug] Supervisor vmq_queue_sup_sup started vmq_queue_sup:start_link(infinity, vmq_queue_sup_20, vmq_queue_sup_20_tab, 5, 10) at pid <0.293.0>
07:07:59.663 [debug] Supervisor vmq_queue_sup_sup started vmq_queue_sup:start_link(infinity, vmq_queue_sup_21, vmq_queue_sup_21_tab, 5, 10) at pid <0.294.0>
07:07:59.664 [debug] Supervisor vmq_queue_sup_sup started vmq_queue_sup:start_link(infinity, vmq_queue_sup_22, vmq_queue_sup_22_tab, 5, 10) at pid <0.295.0>
07:07:59.664 [debug] Supervisor vmq_queue_sup_sup started vmq_queue_sup:start_link(infinity, vmq_queue_sup_23, vmq_queue_sup_23_tab, 5, 10) at pid <0.296.0>
07:07:59.664 [debug] Supervisor vmq_queue_sup_sup started vmq_queue_sup:start_link(infinity, vmq_queue_sup_24, vmq_queue_sup_24_tab, 5, 10) at pid <0.297.0>
07:07:59.665 [debug] Supervisor vmq_queue_sup_sup started vmq_queue_sup:start_link(infinity, vmq_queue_sup_25, vmq_queue_sup_25_tab, 5, 10) at pid <0.298.0>
07:07:59.665 [debug] Supervisor vmq_queue_sup_sup started vmq_queue_sup:start_link(infinity, vmq_queue_sup_26, vmq_queue_sup_26_tab, 5, 10) at pid <0.299.0>
07:07:59.665 [debug] Supervisor vmq_queue_sup_sup started vmq_queue_sup:start_link(infinity, vmq_queue_sup_27, vmq_queue_sup_27_tab, 5, 10) at pid <0.300.0>
07:07:59.666 [debug] Supervisor vmq_queue_sup_sup started vmq_queue_sup:start_link(infinity, vmq_queue_sup_28, vmq_queue_sup_28_tab, 5, 10) at pid <0.301.0>
07:07:59.666 [debug] Supervisor vmq_queue_sup_sup started vmq_queue_sup:start_link(infinity, vmq_queue_sup_29, vmq_queue_sup_29_tab, 5, 10) at pid <0.302.0>
07:07:59.666 [debug] Supervisor vmq_queue_sup_sup started vmq_queue_sup:start_link(infinity, vmq_queue_sup_30, vmq_queue_sup_30_tab, 5, 10) at pid <0.303.0>
07:07:59.667 [debug] Supervisor vmq_queue_sup_sup started vmq_queue_sup:start_link(infinity, vmq_queue_sup_31, vmq_queue_sup_31_tab, 5, 10) at pid <0.304.0>
07:07:59.667 [debug] Supervisor vmq_queue_sup_sup started vmq_queue_sup:start_link(infinity, vmq_queue_sup_32, vmq_queue_sup_32_tab, 5, 10) at pid <0.305.0>
07:07:59.667 [debug] Supervisor vmq_queue_sup_sup started vmq_queue_sup:start_link(infinity, vmq_queue_sup_33, vmq_queue_sup_33_tab, 5, 10) at pid <0.306.0>
07:07:59.668 [debug] Supervisor vmq_queue_sup_sup started vmq_queue_sup:start_link(infinity, vmq_queue_sup_34, vmq_queue_sup_34_tab, 5, 10) at pid <0.307.0>
07:07:59.668 [debug] Supervisor vmq_queue_sup_sup started vmq_queue_sup:start_link(infinity, vmq_queue_sup_35, vmq_queue_sup_35_tab, 5, 10) at pid <0.308.0>
07:07:59.668 [debug] Supervisor vmq_queue_sup_sup started vmq_queue_sup:start_link(infinity, vmq_queue_sup_36, vmq_queue_sup_36_tab, 5, 10) at pid <0.309.0>
07:07:59.668 [debug] Supervisor vmq_queue_sup_sup started vmq_queue_sup:start_link(infinity, vmq_queue_sup_37, vmq_queue_sup_37_tab, 5, 10) at pid <0.310.0>
07:07:59.669 [debug] Supervisor vmq_queue_sup_sup started vmq_queue_sup:start_link(infinity, vmq_queue_sup_38, vmq_queue_sup_38_tab, 5, 10) at pid <0.311.0>
07:07:59.669 [debug] Supervisor vmq_queue_sup_sup started vmq_queue_sup:start_link(infinity, vmq_queue_sup_39, vmq_queue_sup_39_tab, 5, 10) at pid <0.312.0>
07:07:59.669 [debug] Supervisor vmq_queue_sup_sup started vmq_queue_sup:start_link(infinity, vmq_queue_sup_40, vmq_queue_sup_40_tab, 5, 10) at pid <0.313.0>
07:07:59.670 [debug] Supervisor vmq_queue_sup_sup started vmq_queue_sup:start_link(infinity, vmq_queue_sup_41, vmq_queue_sup_41_tab, 5, 10) at pid <0.314.0>
07:07:59.670 [debug] Supervisor vmq_queue_sup_sup started vmq_queue_sup:start_link(infinity, vmq_queue_sup_42, vmq_queue_sup_42_tab, 5, 10) at pid <0.315.0>
07:07:59.670 [debug] Supervisor vmq_queue_sup_sup started vmq_queue_sup:start_link(infinity, vmq_queue_sup_43, vmq_queue_sup_43_tab, 5, 10) at pid <0.316.0>
07:07:59.671 [debug] Supervisor vmq_queue_sup_sup started vmq_queue_sup:start_link(infinity, vmq_queue_sup_44, vmq_queue_sup_44_tab, 5, 10) at pid <0.317.0>
07:07:59.671 [debug] Supervisor vmq_queue_sup_sup started vmq_queue_sup:start_link(infinity, vmq_queue_sup_45, vmq_queue_sup_45_tab, 5, 10) at pid <0.318.0>
07:07:59.671 [debug] Supervisor vmq_queue_sup_sup started vmq_queue_sup:start_link(infinity, vmq_queue_sup_46, vmq_queue_sup_46_tab, 5, 10) at pid <0.319.0>
07:07:59.672 [debug] Supervisor vmq_queue_sup_sup started vmq_queue_sup:start_link(infinity, vmq_queue_sup_47, vmq_queue_sup_47_tab, 5, 10) at pid <0.320.0>
07:07:59.672 [debug] Supervisor vmq_queue_sup_sup started vmq_queue_sup:start_link(infinity, vmq_queue_sup_48, vmq_queue_sup_48_tab, 5, 10) at pid <0.321.0>
07:07:59.672 [debug] Supervisor vmq_queue_sup_sup started vmq_queue_sup:start_link(infinity, vmq_queue_sup_49, vmq_queue_sup_49_tab, 5, 10) at pid <0.322.0>
07:07:59.673 [debug] Supervisor vmq_queue_sup_sup started vmq_queue_sup:start_link(infinity, vmq_queue_sup_50, vmq_queue_sup_50_tab, 5, 10) at pid <0.323.0>
07:07:59.673 [debug] Supervisor vmq_server_sup started vmq_queue_sup_sup:start_link(infinity, 5, 10) at pid <0.273.0>
07:07:59.692 [debug] Supervisor vmq_reg_sup started vmq_reg_mgr:start_link() at pid <0.325.0>
07:07:59.699 [debug] Supervisor vmq_reg_sup started vmq_retain_srv:start_link() at pid <0.328.0>
07:07:59.706 [debug] Supervisor vmq_reg_sup started vmq_reg_sync_action_sup:start_link() at pid <0.330.0>
07:07:59.709 [debug] Supervisor vmq_reg_sup started vmq_reg_sync:start_link() at pid <0.331.0>
07:07:59.713 [debug] Supervisor vmq_reg_sup started vmq_reg_trie:start_link() at pid <0.332.0>
07:07:59.713 [debug] Supervisor vmq_server_sup started vmq_reg_sup:start_link() at pid <0.324.0>
07:07:59.716 [info] loaded 0 subscriptions into vmq_reg_trie
07:07:59.722 [debug] Supervisor vmq_cluster_node_sup started vmq_cluster_mon:start_link() at pid <0.336.0>
07:07:59.722 [debug] Supervisor vmq_server_sup started vmq_cluster_node_sup:start_link() at pid <0.335.0>
07:07:59.730 [info] cluster event handler 'vmq_cluster' registered
07:07:59.736 [debug] Supervisor vmq_server_sup started vmq_sysmon:start_link() at pid <0.337.0>
07:07:59.751 [debug] Supervisor vmq_metrics_sup started vmq_metrics:start_link() at pid <0.339.0>
07:07:59.755 [debug] Supervisor vmq_metrics_sup started vmq_graphite:start_link() at pid <0.341.0>
07:07:59.759 [debug] Supervisor vmq_metrics_sup started vmq_systree:start_link() at pid <0.342.0>
07:07:59.759 [debug] Supervisor vmq_server_sup started vmq_metrics_sup:start_link() at pid <0.338.0>
07:08:00.381 [debug] Supervisor vmq_acl_sup started vmq_acl_reloader:start_link() at pid <0.347.0>
07:08:00.381 [info] Application vmq_acl started on node 'VerneMQ@172.17.0.3'
07:08:00.383 [debug] loading modules: [vmq_acl,vmq_acl_app,vmq_acl_cli,vmq_acl_reloader,vmq_acl_sup]
07:08:00.465 [debug] Supervisor vmq_passwd_sup started vmq_passwd_reloader:start_link() at pid <0.354.0>
07:08:00.466 [info] Application vmq_passwd started on node 'VerneMQ@172.17.0.3'
07:08:00.467 [debug] loading modules: [vmq_passwd,vmq_passwd_app,vmq_passwd_cli,vmq_passwd_reloader,vmq_passwd_sup]
07:08:00.539 [debug] Supervisor {<0.357.0>,ranch_listener_sup} started ranch_conns_sup:start_link({{0,0,0,0},8080}, worker, 5000, vmq_ranch_proxy_protocol, 5000, cowboy_protocol) at pid <0.358.0>
07:08:00.548 [debug] Supervisor {<0.359.0>,ranch_acceptors_sup} started ranch_acceptor:start_link({proxy_socket,#Port<0.9222>,undefined,[{nodelay,true},{linger,{true,0}},{send_timeout,30000},{send_timeout_close,...}],...}, vmq_ranch_proxy_protocol, <0.358.0>) at pid <0.360.0>
07:08:00.549 [debug] Supervisor {<0.359.0>,ranch_acceptors_sup} started ranch_acceptor:start_link({proxy_socket,#Port<0.9222>,undefined,[{nodelay,true},{linger,{true,0}},{send_timeout,30000},{send_timeout_close,...}],...}, vmq_ranch_proxy_protocol, <0.358.0>) at pid <0.361.0>
07:08:00.549 [debug] Supervisor {<0.359.0>,ranch_acceptors_sup} started ranch_acceptor:start_link({proxy_socket,#Port<0.9222>,undefined,[{nodelay,true},{linger,{true,0}},{send_timeout,30000},{send_timeout_close,...}],...}, vmq_ranch_proxy_protocol, <0.358.0>) at pid <0.362.0>
07:08:00.550 [debug] Supervisor {<0.359.0>,ranch_acceptors_sup} started ranch_acceptor:start_link({proxy_socket,#Port<0.9222>,undefined,[{nodelay,true},{linger,{true,0}},{send_timeout,30000},{send_timeout_close,...}],...}, vmq_ranch_proxy_protocol, <0.358.0>) at pid <0.363.0>
07:08:00.550 [debug] Supervisor {<0.359.0>,ranch_acceptors_sup} started ranch_acceptor:start_link({proxy_socket,#Port<0.9222>,undefined,[{nodelay,true},{linger,{true,0}},{send_timeout,30000},{send_timeout_close,...}],...}, vmq_ranch_proxy_protocol, <0.358.0>) at pid <0.364.0>
07:08:00.550 [debug] Supervisor {<0.359.0>,ranch_acceptors_sup} started ranch_acceptor:start_link({proxy_socket,#Port<0.9222>,undefined,[{nodelay,true},{linger,{true,0}},{send_timeout,30000},{send_timeout_close,...}],...}, vmq_ranch_proxy_protocol, <0.358.0>) at pid <0.365.0>
07:08:00.551 [debug] Supervisor {<0.359.0>,ranch_acceptors_sup} started ranch_acceptor:start_link({proxy_socket,#Port<0.9222>,undefined,[{nodelay,true},{linger,{true,0}},{send_timeout,30000},{send_timeout_close,...}],...}, vmq_ranch_proxy_protocol, <0.358.0>) at pid <0.366.0>
07:08:00.551 [debug] Supervisor {<0.359.0>,ranch_acceptors_sup} started ranch_acceptor:start_link({proxy_socket,#Port<0.9222>,undefined,[{nodelay,true},{linger,{true,0}},{send_timeout,30000},{send_timeout_close,...}],...}, vmq_ranch_proxy_protocol, <0.358.0>) at pid <0.367.0>
07:08:00.551 [debug] Supervisor {<0.359.0>,ranch_acceptors_sup} started ranch_acceptor:start_link({proxy_socket,#Port<0.9222>,undefined,[{nodelay,true},{linger,{true,0}},{send_timeout,30000},{send_timeout_close,...}],...}, vmq_ranch_proxy_protocol, <0.358.0>) at pid <0.368.0>
07:08:00.552 [debug] Supervisor {<0.359.0>,ranch_acceptors_sup} started ranch_acceptor:start_link({proxy_socket,#Port<0.9222>,undefined,[{nodelay,true},{linger,{true,0}},{send_timeout,30000},{send_timeout_close,...}],...}, vmq_ranch_proxy_protocol, <0.358.0>) at pid <0.369.0>
07:08:00.553 [debug] Supervisor {<0.357.0>,ranch_listener_sup} started ranch_acceptors_sup:start_link({{0,0,0,0},8080}, 10, vmq_ranch_proxy_protocol, [{ip,{0,0,0,0}},{port,8080},{nodelay,true},{linger,{true,0}},{send_timeout,30000},{send_timeout_close,...}]) at pid <0.359.0>
07:08:00.553 [debug] Supervisor ranch_sup started ranch_listener_sup:start_link({{0,0,0,0},8080}, 10, vmq_ranch_proxy_protocol, [{ip,{0,0,0,0}},{port,8080},{nodelay,true},{linger,{true,0}},{send_timeout,30000},{send_timeout_close,...}], cowboy_protocol, [{env,[{dispatch,[{'_',[],[{[<<"mqtt">>],[],vmq_websocket,[{mountpoint,[]},{allowed_protocol_versions,...}]}]}]}]}]) at pid <0.357.0>
07:08:00.553 [info] Application vmq_server started on node 'VerneMQ@172.17.0.3'
07:08:08.929 [debug] 0ms mailbox traversal, schedule next lazy broadcast in 10000ms, the min interval is 10000ms
```

```
tcpdump: listening on eth1, link-type EN10MB (Ethernet), capture size 262144 bytes
07:19:06.691308 IP (tos 0x0, ttl 64, id 31375, offset 0, flags [DF], proto TCP (6), length 60)
    testcontainer.40261 > 1eb8b33596a5.http-alt: Flags [S], cksum 0x585c (incorrect -> 0x4bfc), seq 4008967672, win 29200, options [mss 1460,sackOK,TS val 9209719 ecr 0,nop,wscale 7], length 0
07:19:06.691337 IP (tos 0x0, ttl 64, id 0, offset 0, flags [DF], proto TCP (6), length 60)
    1eb8b33596a5.http-alt > testcontainer.40261: Flags [S.], cksum 0x585c (incorrect -> 0x06c8), seq 4212507385, ack 4008967673, win 28960, options [mss 1460,sackOK,TS val 9209719 ecr 9209719,nop,wscale 7], length 0
07:19:06.691361 IP (tos 0x0, ttl 64, id 31376, offset 0, flags [DF], proto TCP (6), length 52)
    testcontainer.40261 > 1eb8b33596a5.http-alt: Flags [.], cksum 0x5854 (incorrect -> 0xa5cf), ack 1, win 229, options [nop,nop,TS val 9209719 ecr 9209719], length 0
07:19:06.691887 IP (tos 0x0, ttl 64, id 31377, offset 0, flags [DF], proto TCP (6), length 261)
    testcontainer.40261 > 1eb8b33596a5.http-alt: Flags [P.], cksum 0x5925 (incorrect -> 0xf65f), seq 1:210, ack 1, win 229, options [nop,nop,TS val 9209719 ecr 9209719], length 209: HTTP, length: 209
	GET /mqtt HTTP/1.1
	Host: mqtt:8080
	Upgrade: websocket
	Connection: Upgrade
	Origin: https://mqtt:8080
	Sec-WebSocket-Key: dF8hovdYRxy0fe2oBpU7NA==
	Sec-Websocket-Version: 13
	Sec-Websocket-Protocol: mqtt

07:19:06.691902 IP (tos 0x0, ttl 64, id 17805, offset 0, flags [DF], proto TCP (6), length 52)
    1eb8b33596a5.http-alt > testcontainer.40261: Flags [.], cksum 0x5854 (incorrect -> 0xa4f8), ack 210, win 235, options [nop,nop,TS val 9209719 ecr 9209719], length 0
07:19:06.692006 IP (tos 0x0, ttl 64, id 17806, offset 0, flags [DF], proto TCP (6), length 52)
    1eb8b33596a5.http-alt > testcontainer.40261: Flags [R.], cksum 0x5854 (incorrect -> 0xa4f4), seq 1, ack 210, win 235, options [nop,nop,TS val 9209719 ecr 9209719], length 0
```

**Comment by ioolkos** [comment]
@cbenhagen thanks for opening the issue!
Quick question: what TCP proxy/balancer are you using? are you configureing the proxy protocol too there?

**Comment by cbenhagen** [comment]
Thank you for the quick response! I use NGINX and it is already configured. But to simplify the problem I tried to make a connection from another container. Without even using the proxy.

**Comment by ioolkos** [comment]
Ok. Do things work with NGINX?
In any case, without an actual proxy the proxy protocol will not work.

**Comment by cbenhagen** [comment]
Oh interesting. So I would need a second listener for internal traffic? 

No it does not work with NGINX but I did not try to fix it before as I was expecting it to work with and without a proxy and wanted to keep it simple. Are there any specific requirements for the proxy? Any example NGINX configs you could point me to?

**Comment by ioolkos** [comment]
Yes, you would need to use 2 different listeners if you want to have both options (normal & proxied).

Proxy should forward Source IP, Source Port, this shouldn't need special configuration (for proxy protocol v1). Depending on your use case you would need a little more config than just switching the protocol on (example is TLS etc). I'd refer to NGINX (or respective proxy) documentation to get you started.

**Comment by cbenhagen** [comment]
Ok I will close this issue as this is definitively not a bug. Sorry for the noise.

**Comment by ioolkos** [comment]
No worries, you're welcome asking anytime. Thanks for using VerneMQ :)
